,review,is_positive
1437,neg babi chang facil wing check chang babi howev  allow us access old  resolv complaint,0
1438,  bad almost break leg came  towel water floor ,0
1439, behind recept rude,0
1440, could better standard  would expect higher qualiti cook option mayb order,0
1441,like  pre paid  went caf across road good  half price  good lack bar area plenti  accommod one seem shame,0
1442,bit littl choos ,0
1443,,0
1444,take time check could process one custom time way wait 5 10 min time major issu though,0
1445,water pressur light,0
1446,everyth  pay like coffe  even bag weight minibar ,0
1447,usual parisian small ,0
1448,spa massag full 55 minut expect howev bought manag realli help deduct price also gave email contact directli futur,0
1449, stay small swim pool shown advert look smaller,0
1450,drawer cloth nice closet drawer night stand dresser,0
1451,much natur light due surround build,0
1452, screen bath leak across floor,0
1453,accessarou toilet,0
1454,didnt like  wasnt quit fair compar pictur book especi bath eventhough realli comfort ,0
1455,clear distinct  street familiar street build london could easili walk past  take notic wall floor  door sound proof would much rather disturb nois street guest neighbor   easili hear housekeep  talk walk frustrat five star  one would expect sound proof door least though  rel new eclect theme  way outdat  featur light c curtain control electron sometim work properli,0
1456,hot aircondit work,0
1457,coffe ,0
1458,,0
1459, seen better day cor gener tire variou fit  need repair notabl tabl level sink tap bled black bit use  also stank smoke got wors c turn  gener uninterest earli arriv ask could access  get chang cut leg travel wish dress cut chang cloth blood two three  member ask perplex question despit abl see injuri third  member offer band aid use ladi toilet easi tri open suitcas cubicl five minut   would felt good deal better dispos toward venu particularli like attitud duti manag check rais issu fault  impli problem put past perform ie lack effort stand recept bleed hope anyth would happen impress implic pre arriv email  go upgrad us celebr stay instead gave us one slice ined lemon cheesecak remain unimpress promis follow  regard concern happen  averag servic remain indiffer expect four star  recommend return,0
1460,nois station heard ,0
1461,travel alon singl  fall short expect  small claustrophob  push window terribl draft use cloth seal window suitcas protect draft uncomfort ask chang anoth  situat,0
1462, littl small expect ,0
1463,requir extra pillow never got also lost english channel report never got sort went two day lost channel,0
1464,price  14 top b b offer,0
1465,price charg  includ basic facil like tea coffe bag travel would expect one tap bath leak one occas  clean  tri open  clean  without even knock ensur one insid 9am,0
1466,tea coffe make facil ,0
1467, doubl book taxi arrang chaotic overpr,0
1468,sometim could peopl recept avoid wait time,0
1469,would love swim pool,0
1470, servic easi also refriger  big turn bar downstair alway littl difficult get  support,0
1471,thing need drink make facil  night town enjoy need refresh wake get  get chang make way 5 floor get drink use  2 night would start get irrit lack space ,0
1472,ask 2 connect  extra  gave 2  differ floor extra  avail ask blanket told 2 blanket bad experi,0
1473, wall bit thin could hear peopl next  speak loudli 2 morn suppos depend peopl get next  also   bit expens 13,0
1474,small  view expens,0
1475,holder  head could better excel water pressur mean holder go uncontrol spin lose concentr second,0
1476,hot water hot although  recept check said fix,0
1477,narrow washbasin  rate expens side,0
1478,reason housekeep restock towel everyday,0
1479,one  member look check well oper concierg help line peopl wait pressur hasti question book etc,0
1480,clearer explan car park oper work alright end,0
1481,prearrang tri make restaur skyy bar end mess  food croissant aw horribl scrambl egg everyth hot cold slice fruit dri bake bean skin nobodi appear charg food offer  hot temperatur could control,0
1482,would prefer tea coffe make facil iron although  laundri cost partner would prefer bigger gym person,0
1483,includ ,0
1484, price,0
1485,inform properti alcohol licens confirm book found went restaur dinner eat huge amount option vicin almost spoil break would never consid go back pleas consid inform peopl futur,0
1486,brasseri restaur menu ok could litl interedt,0
1487, rude  cold almost freez,0
1488,restaur floor dirti,0
1489, speak english well long check,0
1490,expens place pay 5 gbp beer  lobbi cheap,0
1491,park conveni,0
1492,lift action 4th floor couldnt help check hour half late due late check out custom ask free drink inconveni apolog offer ,0
1493,standard ,0
1494,place look old curtain  suppos white black dust,0
1495,like issu,0
1496,perhap littl   area bit difficult find way pool ,0
1497,overpr small  ac seem work warm water ,0
1498,smell sweati sock first floor corridor,0
1499,interconnect  noisi request one sound carri cleaner left nearbi door latch whilst clean 7am continu bang ask close apologis happen 2 morn later holiday want lie,0
1500,bought earli checkin arriv  readi wait almost 30 minut go  day tri eat someth bar 10 10pm order sandwich almost 11 pm yet arriv cancel order know sandwich machin troubl tell order food  well train  unfortun sofitel list best ,0
1501,lift break regularli soundproof  soundproof could hear snore next door neighbour mobil phone convers middl night,0
1502,park vallet  could improv,0
1503,late night call housekeep ask  need clean 9 50pm,0
1504,restaur remot  howev short walk approx 10 minut closest metro station  help howev comput recept help get around milan awar air condit two set  decid whether hot cold may need use natur air outsid cool  hot,0
1505,tempetur hot control didnt work,0
1506,radiat  bit noisi  kind help even reserv anoth  us even refund us money,0
1507,rate bit high side,0
1508,call multipl time get 50 euro hold deposit accept  admit fault still good enough,0
1509,  clean,0
1510,particularli like strong  perfum float around entir facil,0
1511,well isol could hear neighbour talk  next door,0
1512,like  much thought rather expens,0
1513,n,0
1514,kept catch leg corner  quit sharp gone home coupl bruis disappoint bath everi thing els excel also would like anoth mirror  hair,0
1515,receptionist chines look black hair neg rude act like mood anyon never saw smile 4 night stay mani role like water boiler iron allow  found  taken away till end stay  limit,0
1516,like everyth ,0
1517, integr multi purpos build apart   area offer facil,0
1518,stair,0
1519,fit facil limit pool small season ok hot day may get crowd  especi bath made solid materi give littl bit cheaper feel,0
1520,lack park  view,0
1521,free wi fi realli ridicul  price,0
1522,far central london,0
1523,could better signpost,0
1524,enter  immedi reaction ingrain dust realli smell like carpet curtain need replac bath clean air condit work constantli ask look woke first two night three hot stuffi  pillow incred hard uncomfort,0
1525,get  pass  entranc kitchen base languag use high volum gordon ramsey work night  good unfortun bath water would drain handbasin due build hair gunk plug hole clean rain  head ceil  almost complet block calc build clean expect 5 star  match price,0
1526,ceram mug would better paper cup ,0
1527, small need mainten,0
1528,carpet hallway date,0
1529, undergo renov known advanc would chosen stay  would seem fair notifi peopl beforehand also four star rate  facil overal appear  come par rate,0
1530,roof top bar expens 30 euro gin whiskey,0
1531,although  look modern electr left lot desir first two bulb light work top hairdryer blew partner dri hair although  best help situat left littl bit bad feel stay,0
1532,bit pain get foot,0
1533, littl small bad thing,0
1534,secur,0
1535,certain smell work quit manli heavi corridor,0
1536,small toilet   hardli contain vegstabl,0
1537,get underground car park steep ramp bike rack back bit hair rais,0
1538,pillow comfort almost flat low hard,0
1539,lift stop 2nd floor steep stair 3rd 4th floor,0
1540,bath heat arrang,0
1541,hot  serv cold plate,0
1542,lack swim pool la rambla seedi drug offer everi corner ladi night quit aggress  fault,0
1543,fact  much smaller websit photo pretend,0
1544,book junior suit reach found small paid extra 500gbp upgrad st jame suit,0
1545, hard strang matrass stay place slide side,0
1546,thought bar area could better,0
1547,check  tri sell us coupl time,0
1548, littl date clean,0
1549,like,0
1550,thermostat need turn ran bath long day london dissapoint request southern view receiv even check  told  lukewarm hit plate becam cold quickli ask 60 deposit mini bar check manag charg instead refund dissapoint first hilton visit,0
1551,would love rate beauti establish higher  friendli help allow checkin 5 30 pleasant experi long flight hang around feel tire need  desper absolut wors could guest,0
1552, ok,0
1553,everi  seem problem exampl two three  stay suffer loos socket cover  blind fall wall  limit e almost item cold food apart boil egg,0
1554,everyth,0
1555,standard facil poor,0
1556,air con work made  stuffi face towel shampoo condition given given flimsi paper cup,0
1557,decor could lick paint,0
1558,thought delux  littl small,0
1559,check welcom,0
1560,everi thing ok except c warm,0
1561,step bath fell hurt first night thought go go glass luckili break anyth,0
1562,towel terribl dirti smelli,0
1563,mix came check us  process took hour eventu dealt point offer much apolog drink bar sort mess disappoint  door  close properli wither affect qualiti stay overal,0
1564,quit small doubl  2 person,0
1565,construct work street close main street entranc taxi car cannot drop main entranc,0
1566,littl food avail bar  good area lot derelict build around good restaur walk distanc even close drive distanc would feel safe night walk back ,0
1567,proper bar area,0
1568,4 elev  still wait long time mani time elev crowd wait next one would also work better  would separ elev skyloung non  guest,0
1569,scrambl egg v poor 18 ,0
1570,like outlook ,0
1571, overpr replenish bath amen,0
1572,read posit mostli event relat  given small tini 2 avail one milan host expo 2015 chose stay 4 day later road trip south given larger  adequ park howev paid least expens,0
1573,cocktail littl expens compar local bar,0
1574, need redecor carpet corridor wron wast bin   un empti,0
1575, could better,0
1576, comfort hard mattessss,0
1577,bath glass frost cubicl  littl privaci would nice  overpr ,0
1578,fo9r 152 night disappoint abl make coffe morn pay one call  servic mini bar incred expens,0
1579,hot ,0
1580,small   window window view wall block possibl view,0
1581,renov reconstruct work go  stay disturb us much,0
1582, cold enter  provid addit heater panel doubl glaze remov lack power point construct bond street made even noisi carpet look old stain,0
1583,weather cold,0
1584,relax food bar area,0
1585,soundproof rather poor could hear peopl talk street window close well train pass underground,0
1586,smelli drain smell bath although could shut door,0
1587,small chair extra  would great nicer sit togeth way,0
1588,pay wifi,0
1589,ok,0
1590, construct site noisi constant drill manag care simpli put stay,0
1591,would recommend  add gym facil area around  look industri district though  secur insid look safe,0
1592,aircondit realli poor  receptionist dint bother fix,0
1593,uncomfort  hard nois corridor leak  due gap door jam,0
1594,entir  need facelift date servic consist guest pay use gym facil sure 4 star,0
1595,,0
1596,didnt like lot first  absolut terribl smile ask guy recept anyth rude didnt help us  small  noisi even move disturb other mean  fun never,0
1597,bath towel small mini bar facil two bottl water nibbl snack uht milk suppli tea coffe biscuit doubl  one glass provid lack toiletri enjoy  would appreci choic ie egg scrambl poach etc 5 star  would expect extra,0
1598, small,0
1599,lot nois door creak time small   mani option,0
1600,small  issu come enjoy see citi,0
1601, littl noisi think  gener,0
1602,30 euro per day extra charg park garag,0
1603, aw design extrem clostrophop dark simpli ugli wifi crazi slow,0
1604, averag  seem bit grumpi particularli help,0
1605,took 5 euro bring bucket ice usuli tip 3 10 euro take mandatori,0
1606,get sandwich 11 except  servic,0
1607, bit stuffi aircon avail,0
1608,full english  could includ rather continent upgrad arriv,0
1609,leav,0
1610,lack consist cleaner suit door rooom bit basic  expect price restaur offer child  expect pay adult price tini amount eat,0
1611,furnitur  littl sad use wardrob ,0
1612,cleaner swim area chang ,0
1613,complaint,0
1614,clean  uncomfort noisi realli help nois outsid,0
1615,wifi free,0
1616,request late checkout well handl,0
1617,noisi kid pool meant go easter expect guess,0
1618,tini  tini elev photo avail internet exagger,0
1619,low standard old fade person look like hostel  poor food everi day realli disappoint standard price paid never back,0
1620,level staf bar could better waiter tri hard attend everyon,0
1621,recept friendli unhelp,0
1622, quit stuffi aircon work mini bar fridg  would good keep drink cold,0
1623,speak concierg pass onto recept clean  noisi morn  604 clean cupboard right next crack tap bath scale bath cleanest,0
1624,garden next road littl noisi,0
1625,lift difficult  upper floor,0
1626,stay  406 follow issu hot  faulti aircon hard  bath cold sparkl clean  door meet top mold grout,0
1627,realli anyth dislik  howev  select could wider varieti choic,0
1628,carpet clean think could chang lot mark stain,0
1629,free water easi notic,0
1630,stay mercur  vari make coffe machin awkward posit alway queue previou   bring coffe pot tabl machin meant get enjoy meal togeth one us queue good portion meal hot drink need refil food littl quicker fruit salad mainli grape littl disappoint,0
1631,fire alarm sensit probabl chang carpet ,0
1632,could fault anyth excel ,0
1633,would prefer  view,0
1634,felt somewhat cramp,0
1635,c,0
1636,recal issu,0
1637,although great inconveni public bar winter month decemb stay roof top terrac bar open summer  front busi main road noisey,0
1638,gener cor carpet  corridor area seen better day made place look littl tire,0
1639,late check,0
1640,everyth good,0
1641,aggress european ,0
1642,minor point coffe  time terribl fault could find place overal good,0
1643,tv work,0
1644,nois  floor,0
1645,tea coffe make facil  fair walk public transport taxi necessari time,0
1646,may earli check would better overal everyth perfect,0
1647,call librari could use bigger select english languag book,0
1648,configur  complic seem walk along way stair bag need better explan  expens,0
1649,long walk elev reach  littl wait time elev three four oper,0
1650,littl bit mani yourng peopl parti ,0
1651, furnitur old cleanli good good wifi coverag  high rate per night old  clean ,0
1652,facil old servic slow wait 30min recept,0
1653, littl expens 14 buffet,0
1654,park easi,0
1655, hard,0
1656,busi street traffic front ,0
1657,like front  stay day back  return trip put front nicer view sleep realli hear drunk shout street,0
1658, littl miser mayb like work easter,0
1659, quit small spend much time  overpr,0
1660, time crowdi littl space peopl need wait other leav tabl find place ,0
1661,old  rude  old  bad hous keep,0
1662,live ground floor donot like,0
1663, small bare move insid ventil bath work well alway stink humid,0
1664,littl ,0
1665,bar area ground floor,0
1666,high price,0
1667,pool realli small  good definit worth 30 per person,0
1668,short stay,0
1669,thrown bar local  bar good select drink bit spars home feel sausag littl anem cook expens experi alcohol mini bar,0
1670,told  undergo renerv book also paid upgrad led believ would get  view eiffel tower disappoint side,0
1671,nil,0
1672, extrem poor atmospher ,0
1673,step enter ,0
1674,window look felt like lift shaft view wait 1 2 hour  snooti head waiter made us feel good enough,0
1675,curtain dusti  bath linen poor qualiti  uncomfort gave back ach tea coffe bit lack lustr expect person make decent cup tea small uh milk one larg bath towel provid two peopl mean one person  wall thin could hear gentlemen next door snore,0
1676,  next store  stair mean quiet noisi also window seal  pretti cold bad due warm blanket though wind blow eg would recommend small children,0
1677,although  king  bath small,0
1678, good compar mani top 4 star  select  buffet limit stay  106 nois air con motor disturb sleep littl,0
1679,chicken curri undercook brought fresh one,0
1680,,0
1681,enough tea bag decor corridor could updat,0
1682, littl dark london realli larg,0
1683, small,0
1684,limit select beverag pool bar,0
1685,small  like boat cabin exactli stylish furnish  bath broken,0
1686,pricey ,0
1687, love  great two issu one feel partial book com failur point told tourist tax surpris extra 30 pound  price wifi  work suffici meant could use smart tv,0
1688,slipper provid avail even ask front desk odd 4 star  also bathrob provid either also toiletri provid apart 2 1  gel shampoo notic say ask front desk front desk  rude exactli friendli either hospit busi welcom farewel greet pleasant though ask someth directli,0
1689,decaf tea,0
1690,lack facil properti swim pool sauna well consid price pay  smoke yet could smell smoke corridor person issu think go put warn everi  regard smoke drug use polic lot vigilantli main thing group lack  facil 4 star properti someth look futur develop,0
1691,refridger  would nice keep drink cold,0
1692,tire old dark decor lobbi fill gaudi bronz statu tire carpet given area   canari wharf echo surround modern novotel open across road need modernis  quickli addit left luggag concierg check upon return mix guest luckili everyth  end howev suggest lack organis commit great servic final left  incid lobbi area water pour ceil alongsid light fit guest notifi  howev  concern faze immin safeti risk pose water electr mix area half heartedli cordon bucket place catch water wrong spot everyon went back work sens urgenc surpris regard maintain issu,0
1693,basic noisi draft window end hot feet cold head lack plug lift kettl boil water floor desk get pay expens tv loud music bar,0
1694,neighborough  reserv low cultur peopl hear,0
1695,slow wi fi  littl bit small dark,0
1696, buffet worth price warm buffet half empti went  second day,0
1697,knightsbridg  millenium  stay millennium new york place around uk littl outdat  chair desk bath hallway decor carpet throughout,0
1698,fault possibl  could slightli better time arriv option run one day use overflow  first floor,0
1699,wifi could perform,0
1700,weak hairdryer,0
1701,issu,0
1702,wifi work,0
1703,duvet singl  twin  cover feet small 5 6 two men came door said need check mattress two girl stay quit intimid especi recept  call let us know check carri,0
1704,poor  compar price small tab walk  sport channel tv,0
1705, busi chat away rather pay attent front counter seem rather rude,0
1706,internet slow need improv,0
1707,next time would pay extra pound larger  select twin forgot much like stretch sleep,0
1708,better loung elderli,0
1709, date comfort,0
1710,noisi even noisi morn ideal either earli night lie  limit unless want pay extra cook option,0
1711,bath smelt like cabbag hall narrow hear quit lot,0
1712,outsid  construct look beauti done,0
1713, could refurb look tire,0
1714,air condit cool ,0
1715,bath littl small,0
1716,window  directli noisi  gener kept us awak night complain offer pathet 50 goodwil gestur instead proper discount properli reflect discomfort experienc,0
1717, comfi hope still love stay,0
1718,thought food bit pricey,0
1719,small ,0
1720,basement  seem odd exec doubl carpet stain  bit old window area cold wasnt view,0
1721,lack modern doubl glaze window sound proof draught free paint work need touch,0
1722,got towel clean  second day gave us one towel small gripe otherwis great stay,0
1723, temperatur 20 maximum jan call front desk adjust told give time warm work  cold,0
1724, far citi center would stay transit amsterdam,0
1725, problem ventil individu exhaust bath duct narrow first impress good afterward ac oper bad good roof ventil solar panel solv problem,0
1726, bit small anyon excess 6 feet tall  made feel bit miser,0
1727, small sink  littl odd,0
1728, way hip mean feel like someon overtri cool  face inner build view dark  feel cold un authent normal enjoy spend time  time didnt much better   ok,0
1729,fact separ bath bath facil split  one side toilet anoth  sink middl  bother much inconveni privat although section whole area  slide door,0
1730,area around  develop better finish,0
1731,neiberhoud quit vocat 5 min walk underground train,0
1732,1 towel kid wich confort,0
1733,travel cot offer 12 month old babi thin hard base mattress come disappoint expect good qualiti mattress ask one book request obvious ignor  read got touch inform could suppli decent travel cot mattress unforgiv choic let babi sleep horribl base especi sinc london 1 night birthday well fever sinc day arriv toss turn night unwel good sleeper actual sleep better fever know suffer fever lot time use luxuri mattress home also babi food could warm restaur offer babi lunch  temperatur first time life cold refus upset enorm,0
1734,disappoint roof bar spa open inform due launch follow week bad smell drainag entranc foyer probabl due ongo build work modern fab colour lack warmth bit steril clinic atmospher perhap fresh flower around offer bardock bar get invit vibe popular busi,0
1735,overpr comparison  stay,0
1736,good,0
1737,n,0
1738,restaur menu limit,0
1739,open plan bath toilet,0
1740,find  signag poor,0
1741,comfort  facil  suck,0
1742, central yet bu station nearbi,0
1743, small doubl singl  complain move 2 night,0
1744, small compar price,0
1745, worth money expens poor servic,0
1746, book famili within expect book five person  small five one bath knew size  small could taken 2  instead l highli suggest  manag alloc adequ  larg famili otherwis  super excel,0
1747,terribl pastri bread  croissant dri old toast bare toast five  egg cook well hash brown clearli frozen  felt littl cold fusti  smell crisp clean although look clean said  comfi duvet soft lack facil expect five star  pool sauna pay extra hammam recent paint bath grout done well white paint gotten marbl look rough rush  bit tire despit sure would grand furnish day need love care realli hit 5 star mark doorman fresher lighter warmer  much much better food,0
1748, tire lot chip paint glu surfac fixtur look poorli maintain  comfort premier inn,0
1749, street bit noisi due traffic,0
1750, small went  seat sit busi,0
1751,husband begin honeymoon request earli check relax gotten plane receptionist told us possibl abl request option confus would wait least 1pm return 1pm chang answer said 2pm strike 2pm allow  futur offer earli check option abl provid one,0
1752, could larger waredrob,0
1753,continent  includ offer pay upgrad full english  told mean   went  money spent,0
1754,siill gabbag left former guest ,0
1755,surround neighborhood felt bit rough,0
1756,bathtub slipperi furnitur need upgrad  need upgrad,0
1757,proper facil  seem much expens  bit far interest place,0
1758, bit cramp ok pari,0
1759,infrastructur old poor  pressur recept underman wait long order ask simpl question whole group us check one person recept around peak moment 7 pm better  card also often deactiv arriv 16th floor  work go way back recept,0
1760,,0
1761,arriv door man help 2 luggag entir lobbi hote 1  littl bit shock felt like famili  2 min  show,0
1762,mayb could littl updat,0
1763,chair  could bit comfort entri ground floor sky sport  mat  biscuit ,0
1764, select bread poor food cook section avail everi day eg mush,0
1765, small air condit poor,0
1766, bit small,0
1767,least one lift order whole four day second one order time housekeep time littl strang either earli morn stilllon  late afternoon come back day,0
1768, citi centr,0
1769,nois could sleep continu slam door guest leav whole night total score 2 instead 5 4,0
1770,small ,0
1771, friendli,0
1772,servic poor  also bar even consid cost ,0
1773,problem get  get main road miss turn least two mile main road turn back,0
1774, bit noisey would happili swap us ask,0
1775,realli like experi extrem overpr,0
1776,request walk  get one,0
1777,c work night n got us fan insuffici ice avail fan hardli slept 2 day hot sound tv volum work bad experu,0
1778,decid upgrad doubl delux doubl sever disappoint delux  one smallest stay countri also unclean 2 quit big coffe hope anyway stain carpet bath sealant miss mouldi complain recept told could move us  full much negoti final knock money size  hilton small,0
1779, littl cold work heat control work mayb wernt work thing annoy us slightli came back concert  obvious taken draught beer bar make buy expens bottl 9 00 bottl beer coke draught beer back first thing morn,0
1780, card issu deactiv coupl day go recept redo also one night around 4 someon enter  without know insid quickli resolv recept offic citi tax includ paid checkout,0
1781,found load men hair  check complain came chang everi thing found men hair toilet disgust thing dirti claim laundri true found dirti everywher yukh,0
1782,descript  superior delux club none applic  shown club  grade standard,0
1783,took 45 minut check three coupl ahead us queue  garag car park poorli explain obviou minor irrit long journey,0
1784,interior style old  size elev small,0
1785,thought  includ extrem expens  expect someth like  inlcud rather pay much  exchang rate chang time differ huge also pay upfront book allow reserv tabl drink rooftop mean night went could sit therefor allow drink whilst stand  tri accommod went elsewher wait group 11,0
1786,lack park poor expens brekfast teribl nois 7am due renov  lack gown slipper,0
1787,everyth apart ,0
1788,bit way tram metro 8min road,0
1789,bath seper door  abl close complet realiz entir  flood,0
1790, slow order,0
1791,nois come collect trash,0
