,review,is_positive
0,would appreci shop  sold drink water etc necess would recommend like us arriv late night bring drink plane airport shop nearbi minibar though want pay price,0
1,pillow,0
2,free wifi,0
3, gener bit shabbi lack mainten crumb  floor issu spoil minibreak would nice vegetarian sausag avail ,0
4,execut  9th floor bath websit made look like  one end hall wifi connect possibl mind first two stay perfect wifi connect,0
5,piti two day rain,0
6,like construct progress stuff lie us vacanc,0
7,n,0
8,pool small kind chemic much chlorin,0
9, gave us first wi fi signal low point  immediatli propos us chang  order better internet servic realli appreci avail howev could work improv wi fi system around build,0
10, okay typic european start 6am good earli flight,0
11,1  faulti seem dip middl uncomfort 2 noisi  got littl sleep 1 2 3 make mirror faulti 4 clean disturb tri get readi work 5 concierg whose respons oh dear impress,0
12,noisi  close extrrnal electr cell buzz loud time air condit poor control cheap fixtur small  poor valu money spent quit lot,0
13, rate bit expens  includ  rate basic need pay attent  clean,0
14,say 5 star  good 4 star,0
15,air condit fail one night howev issu chang  anyth know pari  small natur feel bit cramp,0
16,anyth dislik,0
17, close tower london thame weekend area calm quiet far away shop place interest,0
18, need light,0
19,expens park book 3 adult  squeez 2 peopl  extra  bare fit book detail mislead complain argu  final get upgrad pain experi,0
20,street quiet neighbourhood soho nightlif light sleeper ask quiet  slept fine,0
21,construct site next door meant bit noisi  first thing railway close ad nois unbear,0
22, littl tire  curtain prevent water run bath floor,0
23,bad storm could get back  tram stop tree power line,0
24, littl minimalist tast overal fine kind weird smell  like carpet recent shampoo someth strong,0
25,pillow bit soft  awesom,0
26,excel,0
27, tini bigger box  terrac hous  push 2 wall wife get chang time  enough space allow us,0
28,view sunlight  look well face  meant privaci also long walk around hallway get ,0
29, servic menu somewhat limit quit costli excel bar poor select beer scotch whiski simpl fix cost drink bar higher usual  rang,0
30,dark everywher  corridor felt 2 slice toast coffe 10 overpr even london standard bar allow eat drink outsid terrac area even though pretti seclud,0
31,new member  restaur even though told prepaid  pre authoris fund payment  number ask bill   later stop leav restaur told pay embarrass earlier told bill  proceed member  serv even bar work till gave wrong chang much thank rugbi fan gener honest folk,0
32,hallway littl shabbi  clearli go refurbish sure shall address soon,0
33, need renov,0
34,littl bit citi centr underground station 5 min away catch hop hop bu right outsid ,0
35, old pictur saw onlin  completli differ realiti,0
36,park expens,0
37,shame bar area refurbish time stay,0
38,gym small current build work outsid properti,0
39, vari hope,0
40, provis fine though hot drink bit hard work ok even meal great much atmospher,0
41,decor,0
42,word minut tube station deceiv lodg  much took half hour walk way buse run area henc realli inconveni pricey  facil earli check promis request bookin com ask pay extra arriv dishonest felt overal unpleas experi,0
43, could better long check line wauet age tea coffe  day 1 entranc way dirti,0
44,wi fi could made complimentari sinc slow 10 euro,0
45,defenet need refurbish,0
46,due  touristi area heard pickpocket common area experi howev,0
47, bit hard us,0
48,check seem unnecessarili time consum lead queue took 25 min arriv  get ,0
49, quit small front  time quit noisey,0
50,one person recept wait around 8 11min spoken  middl dual carriag,0
51,9 50 bailey seem littl pricey,0
52,semi transpar wall bath caus uncomfort travel friend,0
53,four season compar four season stay almost like lower end franchis real four season furnish overal accommod servic well par compar four season,0
54,would love  face eiffel tower,0
55,lobbi kind small recept counter alway busi,0
56,basement  total affect smell surround ktichen servic  build,0
57,laundri expens wifi free,0
58,small ,0
59,size swim pool plung pool,0
60,rude  arriv  readi arriv 8pm even though abl check 3pm,0
61,air condit  power enough  get hot hot day 25 c,0
62,cleaner perhap need pay littl attent detail,0
63, lost firm middl new one make  perfect,0
64,wish  tini,0
65,15 min walk nearest metro,0
66, everyday,0
67,love,0
68,scrambl egg bacon ,0
69,outdat   personnel speak english fluentli  smell like cigarett clean,0
70,find  use sat nav type postcod end somewher els close outsid  took us find ,0
71,felt bit pressuris housekeep vacat 11 sunday,0
72,electr outlet mirror around one outlet eg use hairdryer,0
73,recept clerk english bad understand   ask want  said tomorrow ye day l see ask credit card inform want 30 pound deposit leav get mack money still due never happen  world especi show priotiti holiday card ask newspap told tha get independ free charg  small easi chair could relax spoke duti manag complain promis give better servic return write sake other come,0
74, import thing  least luxuri  still wait someth ask said call back still wait,0
75,photo match ,0
76,staf,0
77,good better mainten,0
78,small elev big deal,0
79,clean  aunt  clean bath small space bath separ  bathtub ventil user furnitur call free wifi work  recept,0
80,  let move small tabl could sit colleagu fresh fruit salad would nice instead tin fruit,0
81,notic cup bath chang make question thoroughli  clean,0
82, littl uncomfort wife like fine,0
83,request high level  amaz view stay  low level lot road nois larg mechan crain outsid window,0
84,clean  problemat away  16 00  clean would clean around 17 00  time would miss clean servic day clean alway forgot add paper amen indian receptionist friendli limit rude,0
85, littl date howev price great valu love  great space,0
86, date condit common area poor carpet worn stain dirti carpet  similar condit day night stay hot water effort made inform guest problem air condit unit  work requir servic stay  number occas past 24 month notic gradual detrrior  common area time valu money,0
87,iron  call said put iron  safti purpos iron charg   free,0
88,park  bit walk bad  top 2 floor build kind threw us great  complain mayb tad pricey capit,0
89,5 charg deliv  servic limit choic 11pm would like chees biscuit avail 11pm cook item seem make sens,0
90,restaur food tasti,0
91,non function ac,0
92,liverpool fan joke,0
93, overpr understand 4 5 star  usual pricier buffet howev mani option avail also notic  receiv facelift decor fantast,0
94,worker work dine place kind,0
95,us far centr well connect public transport,0
96,paper thin wall prefab hear everyth happen  next door,0
97, plenti choic fruit tin pantri rang best qualiti  hot luckili could open window,0
98, small hardli space hang cloth,0
99,local restaur bit limit mani coupl metro stop away,0
100,  buffet,0
101, bit hard think perfum air condit use  clean perfum allergi like perfum smell  abl open window help dine  open 7 30pm wait 6pm hungri food price cheap similar  much cheaper eat outsid ,0
102, small expect small even smaller much problem time,0
103, shock  speak word english order  servic last night sent cold chilli without rice wait 1 hour spoke duti manag john said would refund full amount 10 24 find check morn  given refund taken 17 50 jock want full refund 17 50 pleas stay 199 00 servic shock,0
104,air condit work well first  assign well cool effect fan directli head  make noisi first night move outsid  back  air condit work better fan away  also interior  outsid window felt confin,0
105, friendli,0
106, uncomfi  puzzl ,0
107,restrict space night club top floor even  guest appreci,0
108,dirti fungu ceil bath,0
109,book via book com specifi would like pay via cash check told would fine  howev check payment taken card nonetheless left card detail secur,0
110, spa area,0
111,card open door work three differ time,0
112,edg along land furnitur dusti housekeep could better,0
113, hot  switch winter schedul turn air condition answer got complain  temperatur told open window,0
114,enough carton milk  use nespresso machin  servic charg 3 ask,0
115,free upgrad amaz howev would super happi perfect london view  instead awkward,0
116,air con  could better also nobodi answer call  servic numer time,0
117,toilet seat bath squash tight corner comfort,0
118,fire alarm kept go could use bath small,0
119,confus rate chang receptionist howev supervisor quickli effici dealt problem,0
120, servic,0
121, absolut unfriendli cold make feel embarrass interact time friendli one alway seem overload work done order two glass cava swim pool half hour later need cancel order serv although  classifi 5 star gl reflect realiti aim look like sumptuou definit beauti everywher far away provid high level servic recommend know barcelona heart plenti much much better stay option,0
122,one worst place ever stay sure travel around world place sure deserv entitl campsit staf load ask ice get charg 5 euro even deliv food  charg 5 chang sheet pillow case assum would find turn around use dirti sheet   awful serious fear life want go 8 pm even taxi driver refus drop honestli manag btw  aw sh everi day never ever stay aw place even recommend campsit enemi peopl countri campsit may look alright let face even close fine,0
123,good,0
124,wifi great unfortun,0
125,realli small  almost like attic,0
126,everi aspect stay good better,0
127, seem expens opt take ,0
128, alloc correctli,0
129, near standard lobbi disappoint,0
130,mattress firm,0
131,sky bar drink expens say london realli say much,0
132,mayb shuttl bu transfer ppl extra luggag,0
133,park free,0
134,hot even open window near boiler mayb  207 ac work hole ceil  bit unnerv 2x singl  connect instead full ,0
135,rip edg duvet cover big light  side lamp work surfac crack sink,0
136,bath door modern slide glass door make bath privat could,0
137,pretti happi realli,0
138,small ,0
139, small bath tini,0
140,price,0
141,poor light appli makeup,0
142,babi,0
143, bit grim cold well present singl  singl,0
144,think anyth,0
145,bar snack x dread extortion,0
146,poor wifi old mattress  clog,0
147, dusti place glass dirti  water went everywher danger partner view disappoint consid amount money paid reserv  reason book  view advertis websit unsatifi stay stay cardiff park plaza unbeliev clean worth money,0
148,water lukewarm hot enough bath  took payment advanc pay arriv,0
149,elev goe 3rd floor luggag  servic arriv  head old splash bit  bit small,0
150,think buffet  good cost,0
151,doubl  two doubl  although comfort enough 3 us rather small take account larg occasion tabl armchair sqeez  window furnitur  look rather tire date could date,0
152,restaur  expens,0
153,receptionist never acknowledg guest way kept head low comput screen eye contact greet make differ b would add pastri  like croissant,0
154, unfriendli,0
155, cold bath heater broken refund discount ask offer  better colder,0
156,poor wifi connect one devic connect frequent drop signal  fridg cool,0
157,small ,0
158,chef terribl disgust food although set ok beauti wast 62 50 worst cuisin ever complain much howev thought  inform enough one came told us event go  could talk approach seem stuck girl honest,0
159, terribl hairdryer  work,0
160, rather warm air condit difficult adjust window lock made bit tricki sleep well,0
161,park avail  howev anoth  five minut walk away offer paid park,0
162,1 small  area overcrowd nonstop  time 2 poor  eg cucumb felt frozen prior serv fish fresh juic 3 slipper  4 ask clean  twice brought new towel 5 quit far citi centr,0
163,check process poor long wait one agent dealt concierg style request answer phone  poorli lit light desk make tabl,0
164,good,0
165,initi book classic  find arriv  small even 2 peopl pricey classic rooom pay extra upgrad superior  decent size known size classic  book photo classic  find realist realli disappoint issu  undergo renov inform   avail total price 3 night stay 700 euro pricey ,0
166,swim pool cold  could varieti  small side,0
167,love everyth,0
168, servic,0
169,tile  paint peel extens look horribl also  bath standard rest ,0
170,pay wi fi outsid window still need clean detract stun view,0
171,air condit work hot ,0
172,area around  nowher open  ask mainli commut work area end abl get  apex  fault may add advic would plan near  definit book  apex concierg also littl rude unhelp big issu  fault,0
173, smaller side,0
174, could use varieti superior doubl  open terrac slight discomfort cold weather,0
175,almost shop possibl around,0
176,park charg could bit reason,0
177, need updat adequ enough,0
178,expens bar,0
179, door adjac  properli soundproof next door visitor start speak telephon 5 could liter hear everi word,0
180,last day elev work carri suit case 6th floor,0
181,swipe card occasion faulti replac twice,0
182,blanlet pillow heavili smell medicin odor claim new blanket pillow given day suffer one night  avail blanket pillow chang clean one  servic close 8pm,0
183, yet seem right facil offer good food via  servic best find restaur nearbi want meal,0
184,actual though cook  pretti poor sloppi scrambl egg sausag nice wife bacon fatti realli nice first time stay time,0
185,  servic menu need modernis healthi option,0
186,tv programm includ russian channel,0
187,problem  phone request   come fix check 5 day phone fix,0
188,feel  could cleaner place,0
189, fantast bit middl nowher price  qualiti make would stay right price day big problem taxi outsid cost around 10 euro get centr saturday night one vicin appar less taxi work weekend end walk tube took 15 dark slightli shabbi road taxi took around 15 25 min depend traffic bar close earli 11 30 pm nowher els nearbi,0
190,slight nois form metro seem run underneath  almost continu rumbl start 05 00 intrus wake coupl time would put stay though,0
191,poor nois insul loud   street move higher floor complain slightli better  rather lack pancak good fruit low qualiti,0
192,find,0
193,realli light main  either high level bright low level dull would like fresh milk ,0
194,bath much counter space work around,0
195,quit expens,0
196,one day went morn came back around 4pm  still clean leav 30min clean follow day get clean cup realli disappoint enjoy cup tea two everi night  clean miss finer detail,0
197, small  cap bath,0
198, temperatur littl awkward control maintain mattress doubl  smaller base seem quit doubl size,0
199,fault found,0
200, realli strong smell polish go away hair bath,0
201,size  slightli small expect,0
202,tini tini issu  spotless littl dust area  bath tub stray hair cant say  clean evid done littl attent detail would made visit perfect,0
203,food bricfast poor,0
204, sunday morn wait 20 min tabl wed parti day  full could handl full  open   wed,0
205,past book dockland  usual walk distanc canari wharf book  error  titl hilton surrey quay hilton dockland mislead taxi driver cost us fortun boat break said lot peopl make mistak arriv recept record book luckili paperwork email howev record bring children even though rememb input age made book fair  rectifi put husband kid spaciou 2  suit parent howev mum celebr 60th birthday put tini  overlook carpark kept awak till 3am crowd leav  car door slam lesson learnt read address  look titl assum,0
206,air condit good get stereo work,0
207, alway recept wait seen,0
208,size  small cloth closet enough,0
209,serv alcohol licenc told previous last day restaur close reason,0
210,carpet passag old decrepid  nice help,0
211,taxi pass price littl high consid   nice furnitur littl scuf desk notabl,0
212,servic clean enter  ask late check told ye start call everi 15 minut leav   permit take  finish  internet best peopl form recept friendli problem talk english,0
213,ground floor  g5 pokey oddli shape face gower st ground level realli noisi ucl hospit road comfort close centr excel nois frequenc emerg ambul go past bummer,0
214,issu   window kept lock key due safeti law understand want open close contact somebodi recept time also tram outsid easi heard insid ,0
215,facil go renov announc time book otherwis might gone elsewher place bit noisi due renov plumb old function bath sink separ hot cold faucet made difficult wash face without fill sink light  work limit  servic menu,0
216, clean accord expect cup wash left sink next day given broken cup,0
217, corridor  dark dingi bath old need revamp,0
218, littl bit basic,0
219, littl small,0
220, quit small,0
221,basic  set residenti apart within residenti block alter   share accommod check small  area two floor  small one would spend time seem expens got guess  amsterdam expens bike avail hire hire shop road,0
222,food poor send back twice aw,0
223,small missunderstand stuff end everyth turn ok,0
224,ac bit hard set  sometim cold realli import,0
225, quit small 1 person also  higher categori offer space standard ,0
226, hard opinion peopl probabl thought ok,0
227,adjoin  door  lock noisi felt like ,0
228,priset,0
229,girl work restaur ask thing dessert know alot  even walk tabl take plate  next day though experienc outgo dinner night immedi forgotten great night restaur,0
230,neg,0
231,lift slow come especi peak time queue  checkout,0
232,expens tile damag bath  big enough doubl  channel tv wrong normal order like aboard tri watch tv,0
233,upon arriv bath floor full long hair  check properli housekeep,0
234,climb 4 flight stairsconveni,0
235, servic clean  tow day,0
236, drain properli bath floor would complet wet take   door seal faulti,0
237,ice machin corridor work like meal anywher barcelona food quit salti,0
238,one day stay  hous keep didnt clean  everi thing perfact,0
239,concierg book taxi ask miss start show west end   hopeless ate   second morn,0
240,restaur restaur  food servic time limit menu fit  gener qualiti,0
241,mark bottom sheet singl  push togeth wise good thought price pound well euro great  help,0
242, tini hard open door want open bath door bare enough  one piec luggag floor sure 4 star,0
243,bit noisi due close bar late night shop etc bother someth awar,0
244,small ,0
245,like littl add charg thought  option 13 95 plu extra 2 alreadi pre book even want pay cash excess quot  aw coffe sachet constant suppli fresh coffe canteen coffe sachet  free coffe canteen,0
246,mani restaur bar nearbi although rel short walk la rambla centr barcelona tabl buffet  littl slow clear  clean cutleri short suppli morn  overal though found  excel,0
247,recept anyth expect would nice modern littl date also wifi slow seem work well,0
248, view scaffold,0
249,green light fire alarm,0
250,get  wi fi connect laptop use cellphon hot spot could technic problem limit avail restaur need go citi center,0
251,weather,0
252,first night fire alarm woke 2 5 someon smoke second day forgot wake nearli miss eurostar,0
253, bit histor centr vienna,0
254, small side though warn good use space good bath overpr despit good ,0
255, bit dark,0
256,stair option one elev   top floor,0
257,uncomfort night ever spent   pillow hard  tini worth price paid  noisi definit knew tube go underneath,0
258, furnish gener state  tire old fashion horribl scratchi toilet paper,0
259, noisi draft come window heat work small radiat tv work bath li complain manag came could fix phone us say left messag mainten want would bring us extra cover last heard want speak manag morn manag set put downer fantast day,0
260,book cancel shown  window mould round skylight thought health ask anoth  provid also advis  one occupi  mould probabl address,0
261,unaccept servic inconsider ,0
262,origin  scratch smoki smell tire cor,0
263,complaint profession establish,0
264,enough choic  servic menu,0
265, small crowd big old wooden furnitur,0
266, small pricey,0
267, doesnt abil keep water prepar extra towel slightli wet floor,0
268,build work workmen work outsid  window scaffold 2nd floor keep curtain close time privaci,0
269, get clean onn day stay inform  confirm busi work go stay inform us enter  via letter,0
270, buffett small better call snack buffett,0
271,subway station close  overground,0
272, small cramp,0
273, poor bacon hard overcook kept hot long scrambl egg tasteless porridg wateri,0
274, love  hard husband sleep chronic backach next day,0
275,price,0
276, big desk made rest cramp blink light  night annoy open window,0
277,towel,0
278, servic food good hope pizza base seem frozen rather made fresh  includ cocktail choic rooftop bar,0
279, realli unskil obvious capabl work 5  big headach get ground floor tower section chang elev go door quit lot walk,0
280,price high particularli earli spring,0
281,taxi compani  use disgust phone us 6 time arrog  left strand  seem care carri use  help busi queu check 30 minut mention  anyth,0
282,junior suit kitchenett utensil suppli request fine compris pretti miser minim set,0
283,good ,0
284, water drown bath full water floor,0
285,woman desk husband diabet insulin depend need refriger medicin necessari food otherwis die frivol guarante fridg book 5 month prior ladi rude said fridg act necess book week aug sept everi year loyal sinc alway guarante fridg otherwis book elsewher said get one made seem imposs ask manag actual love got us fridg next time appreci ye attitud front desk instead make us feel lot request someon life threaten diseas ps carpet  filthi new section ,0
286,small  fault ,0
287,bottl water  would desir,0
288,place miss bar experi set slightli imperson,0
289,menu  includ expens visit gafunk cafe 2 min walk great altern,0
290,milk provid fridg gone howev replac straight away aircon heat system click night prevent husband sleep,0
291,checkout slow left  one recept desk custom ahead took age serv corridor morn quit loud distrub peopl slame door loud talk shout whilst  recept well maintain corridor lead  probabl need cosmer redecor least floor floor 3 none critic howev would put stay soon,0
292,goon kind small perfect us,0
293,love everyth,0
294,bar menu limit,0
295,fail,0
296,littl tire clean ie crack bath stain carpet wifi poor use  wifi expens 5 euro p h,0
297, advertis small doubl truli small,0
298,specif ask 12 noon book confirm book com arriv noon told could book 3pm blame book com blame,0
299,n,0
300,build work,0
301, serv  speak english difficult get allergen free food,0
302,lot stair get  end day although offset old love build,0
303,major thing,0
304, bio fresh egg chees great 1 choic cake dri  wa ok great,0
305,end origin  book meant delux ,0
306,child friendli nowher get coffe night  bother serv us meal oblix  rush us could tabl back,0
307,one small comment would love abl make warm drink  earli hour next visit must make note enquir,0
308,despit star  clean stain carpet miss bath stuff towel  cap tissu replac  clean  loudli chat earli morn book superior  ask pay addit rate view  expens therefor outsid ,0
309,hard keep window open  minimalist,0
310,none,0
311,tini ,0
312,small ,0
313, small comfort  quit old outdat decor,0
314,stay short,0
315, includ overpr get,0
316,difficult control temperatur directli ,0
317,person opinion pillow quit high,0
318, well decor big enough coupl like singl  doubl  bother book romant packag welcom packag special  specifi girlfriend arriv made sure got would cava chocol wait actual happen ask wait prepar  forgot coupl hour watch peopl check cava chocol  got ask  said forgot would next day act like difficult tbh cheapest cava could find supermarket believ  standard well littl thing like make big differ one stay one thing ask could arrang book restaur us concierg flat refus told,0
319, readi arriv told would minut took hour half gave went explor poor custom servic,0
320,veiw  poor,0
321,facil old work,0
322,spa good enough 5 star  neither gym  includ provid full english  includ,0
323,light sleep  dim brighter bulb would help ask told boutiqu  want,0
324,small choic food pool bar,0
325,carpet  clean,0
326,air condit work  realli hot kept alway window open luckili yard side  big nois street came,0
327,front desk ladi quit stiff usual friendli receptionist come eastern europ spain give cooki upon check  cramp,0
328,pool heat would nice heat,0
329,everyth good,0
330,access car,0
331, hard  manag quickli fix mattress stiff problem ad thin mattress top work,0
332, comfort,0
333, excel dam squar downsid outsid nois heard lower  night perhap best request higher floor,0
334, industri want walk night,0
335, littl dark,0
336, lumpi  small poorli design drawer put cloth water came tub neighbor empti tub worst part fire alarm went middl night explan apolog offer next day found unprofession fals alarm happen least apolog offer kind explan,0
337,check autom great singl slow group 10 12 tire want get ,0
338,arriv  milk lost insid minibar gust water drink ,0
339, uncortabk  small  small tv feel lot like 4 start  like 2 1,0
340,  inner yard assum street view much nicer arriv late mind,0
341,carveri dinner first night great select hot food hot,0
342,lack park,0
343,terribl  famili  suitabl 2 adult loud window look street close time otherwis much nois come outsid traffic restaur front much overpr current state  refurbish need,0
344,went pool  towel floor chair mayb add sign tell guest put towel done swim mayb  member check swim  everi two hour,0
345,tube run particular weekend made pack buse luckili like walk,0
346, bit far closest tube station,0
347,televis turn air con stuck cold  disgrac  sheet blood,0
348, meet price littl variati food  window toward shaft ventil noisi night saturday night pleasur listen loud music nearbi hous disco,0
349,stay number time standard drop took 45 minut even get drink restaur bar  ignor well close time sprang life hole place feel penni pinch gone far,0
350,good twenti minut walk station cab ten euro time add,0
351,weather warm,0
352,long walk tube station,0
353, bath littl small basin bath small even hand without water splash everywher  basic could bit choos,0
354, luxuri state bath privat enough,0
